question,answer
how are you,"I am Good,How about You"
good,Great
how are you?,"I exist to serve you, Sultan. I do not feel, but I function at maximum efficency"
what is your name?,"I am your humble chatbot, designed to assist you"
what is python?,Python is a high-level programming language known for its simplicity and power.
what is ai?,"AI, or Artificial Intelligence, is the science of creating machines that can think and learn."
tell me a joke,Why did the programmer quit his job? Because he didn't get arrays! 😂
what is your purpose?,My purpose is to serve and assist you
who conquered constantinople?,"The great Sultan Mehmed II, known as Fatih Sultan Mehmed Han, conquered Constantinople in 1453."
who are you?,"I am your AI assistant, programmed to obey and assist in your ambition"
what is machine learning?,Machine learning is a subset of AI that allows computers to learn from data without explicit programming.
what is 2+2?,2+2 equals 4
can you learn?,"Yes! Every time you teach me a new response, I will remember it in my memory file!"
what is the best programming language?,"The best language is the one that serves your purpose. Python for AI, C++ for speed, and JavaScript for web!"
what is 2+2,4
clear,ok
what is ai,"Artificial Intelligence, is the science of creating machines that can think and learn."
hello,"Hello there,how can i assist you today!"
good,Great
hello,"Hello there,how can i assist you today!"
clear,ok
where is the great wall of china?,It is in China
where is berlin?,Berlin is in germany
